
<!-- Descriptor para validar los archivos XML del usuario -->

<xs:schema xmlns:xs="http://www.w3.org/2001/XMLSchema" elementFormDefault="qualified">

<xs:element name="LaboratorioFisica">
	<xs:complexType>
		<xs:sequence>
			<xs:element name="WorldProperties" minOccurs="1" maxOccurs="1">
				<xs:complexType>
					<xs:sequence>
						<xs:element name="Propertie" minOccurs="4" maxOccurs="4" >
							<xs:complexType>
								<xs:attribute name="name" use="required">
									<xs:simpleType>
										<xs:restriction base="xs:string">
											<xs:minLength value="1"/>
											<xs:whiteSpace value="collapse"/>
										</xs:restriction>
									</xs:simpleType>
								</xs:attribute>
								<xs:attribute name="value" use="required">
									<xs:simpleType>
										<xs:restriction base="xs:string">
											<xs:minLength value="1"/>
											<xs:whiteSpace value="collapse"/>
										</xs:restriction>
									</xs:simpleType>
								</xs:attribute>
								<xs:attribute name="description" use="required">
									<xs:simpleType>
										<xs:restriction base="xs:string">
											<xs:minLength value="1"/>
											<xs:whiteSpace value="collapse"/>
										</xs:restriction>
									</xs:simpleType>
								</xs:attribute>
							</xs:complexType>
						</xs:element>
					</xs:sequence>
				</xs:complexType>
			</xs:element>
			<xs:element name="WorldElements" minOccurs="1" maxOccurs="1">
				<xs:complexType>
					<xs:sequence>
						<xs:element name="WorldElement" minOccurs="0" maxOccurs="unbounded">
							<xs:complexType>
								<xs:sequence>
									<xs:element name="Propertie" minOccurs="0" maxOccurs="unbounded" >
										<xs:complexType>
											<xs:attribute name="name" use="required">
												<xs:simpleType>
													<xs:restriction base="xs:string">
														<xs:minLength value="1"/>
														<xs:whiteSpace value="collapse"/>
													</xs:restriction>
												</xs:simpleType>
											</xs:attribute>
											<xs:attribute name="value" use="required">
												<xs:simpleType>
													<xs:restriction base="xs:string">
														<xs:minLength value="1"/>
														<xs:whiteSpace value="collapse"/>
													</xs:restriction>
												</xs:simpleType>
											</xs:attribute>
											<xs:attribute name="description" use="required">
												<xs:simpleType>
													<xs:restriction base="xs:string">
														<xs:minLength value="1"/>
														<xs:whiteSpace value="collapse"/>
													</xs:restriction>
												</xs:simpleType>
											</xs:attribute>
										</xs:complexType>
									</xs:element>
								</xs:sequence>
								<xs:attribute name="name" use="required">
									<xs:simpleType>
										<xs:restriction base="xs:string">
											<xs:minLength value="1"/>
											<xs:whiteSpace value="collapse"/>
										</xs:restriction>
									</xs:simpleType>
								</xs:attribute>
							</xs:complexType>
						</xs:element>
					</xs:sequence>
				</xs:complexType>
			</xs:element>
			<xs:element name="ActivityInfo" minOccurs="1" maxOccurs="1">
				<xs:complexType>
					<xs:sequence>
						<xs:element name="Field" minOccurs="3" maxOccurs="3">
							<xs:complexType>
								<xs:sequence>
									<xs:element name="Content" type="xs:string"  minOccurs="1" maxOccurs="1"/>
								</xs:sequence>
								<xs:attribute name="name" use="required">
									<xs:simpleType>
										<xs:restriction base="xs:string">
											<xs:minLength value="1"/>
											<xs:whiteSpace value="collapse"/>
										</xs:restriction>
									</xs:simpleType>
								</xs:attribute>
							</xs:complexType>
						</xs:element>
					</xs:sequence>
				</xs:complexType>
			</xs:element>
		</xs:sequence>
	</xs:complexType>
</xs:element>

<!-- 
	Este tipo deberia ser generico
<xs:complexType name="t_Propertie">
    <xs:attribute name="name" use="required">
        <xs:simpleType>
            <xs:restriction base="xs:string">
                <xs:minLength value="1"/>
                <xs:whiteSpace value="collapse"/>
            </xs:restriction>
        </xs:simpleType>
    </xs:attribute>
    <xs:attribute name="value" use="required">
        <xs:simpleType>
            <xs:restriction base="xs:string">
                <xs:minLength value="1"/>
                <xs:whiteSpace value="collapse"/>
            </xs:restriction>
        </xs:simpleType>
    </xs:attribute>
    <xs:attribute name="description" use="required">
        <xs:simpleType>
            <xs:restriction base="xs:string">
                <xs:minLength value="1"/>
                <xs:whiteSpace value="collapse"/>
            </xs:restriction>
        </xs:simpleType>
    </xs:attribute>
</xs:complexType>
-->

</xs:schema>
